{
  "schema": "video_catalog_editorial/1",
  "title_reviews": [
    {
      "accession": "016",
      "youtube_id": "Zj7fSZFSaBU",
      "title_source": "А-А-Зализняк-Строй-ведийского-языка-Лекция-1-12092015",
      "generated_title_display": "А. А. Зализняк Строй ведийского языка Лекция 1 12092015",
      "decision": "overridden",
      "title_display": "А. А. Зализняк. Строй ведийского языка. Лекция 1. 12.09.2015",
      "evidence": [
        {
          "url": "https://www.youtube.com/watch?v=Zj7fSZFSaBU",
          "label": "YouTube title (oEmbed)",
          "accessed_at": "2026-08-04",
          "supports": [
            "title_display"
          ]
        }
      ]
    },
    {
      "accession": "059",
      "youtube_id": "XkzmxzvwAVQ",
      "title_source": "А-А-Зализняк-Грамматический-строй-санскрита-2014-2015-гг-Лекция--3-27092014",
      "generated_title_display": "А. А. Зализняк Грамматический строй санскрита 2014 2015 гг Лекция 3 27092014",
      "decision": "overridden",
      "title_display": "А. А. Зализняк. Грамматический строй санскрита. 2014-2015 гг. Лекция 3. 27.09.2014",
      "evidence": [
        {
          "url": "https://www.youtube.com/watch?v=XkzmxzvwAVQ",
          "label": "YouTube title (oEmbed)",
          "accessed_at": "2026-08-04",
          "supports": [
            "title_display"
          ]
        }
      ]
    },
    {
      "accession": "060",
      "youtube_id": "zjOVQqgwc1g",
      "title_source": "А-А-Зализняк-Грамматический-строй-санскрита-Лекция-1-13-09-2014-МГУ",
      "generated_title_display": "А. А. Зализняк Грамматический строй санскрита Лекция 1 13 09 2014 МГУ",
      "decision": "overridden",
      "title_display": "А. А. Зализняк. Грамматический строй санскрита. Лекция 1. 13. 09. 2014. МГУ",
      "evidence": [
        {
          "url": "https://www.youtube.com/watch?v=zjOVQqgwc1g",
          "label": "YouTube title (oEmbed)",
          "accessed_at": "2026-08-04",
          "supports": [
            "title_display"
          ]
        }
      ]
    },
    {
      "accession": "061",
      "youtube_id": "lo2wxrH6U9s",
      "title_source": "А-А-Зализняк-Из-лекции-26-декабря-2011-г-Разбор-RV-10135",
      "generated_title_display": "А. А. Зализняк Из лекции 26 декабря 2011 г Разбор RV 10135",
      "decision": "overridden",
      "title_display": "А. А. Зализняк. Из лекции 26 декабря 2011 г. Разбор RV 10.135",
      "evidence": [
        {
          "url": "https://www.youtube.com/watch?v=lo2wxrH6U9s",
          "label": "YouTube title (oEmbed)",
          "accessed_at": "2026-08-04",
          "supports": [
            "title_display"
          ]
        }
      ]
    },
    {
      "accession": "062",
      "youtube_id": "96yszA1N9r8",
      "title_source": "А-А-Зализняк-Из-лекции-27-ноября-2010-г-Разбор-RV-1034",
      "generated_title_display": "А. А. Зализняк Из лекции 27 ноября 2010 г Разбор RV 1034",
      "decision": "overridden",
      "title_display": "А. А. Зализняк. Из лекции 27 ноября 2010 г. Разбор RV 10.34",
      "evidence": [
        {
          "url": "https://www.youtube.com/watch?v=96yszA1N9r8",
          "label": "YouTube title (oEmbed)",
          "accessed_at": "2026-08-04",
          "supports": [
            "title_display"
          ]
        }
      ]
    },
    {
      "accession": "063",
      "youtube_id": "9hz2kCabk5k",
      "title_source": "А-А-Зализняк-Из-лекции-4-декабря-2010-г-Разбор-RV-1034",
      "generated_title_display": "А. А. Зализняк Из лекции 4 декабря 2010 г Разбор RV 1034",
      "decision": "overridden",
      "title_display": "А. А. Зализняк. Из лекции 4 декабря 2010 г. Разбор RV 10.34",
      "evidence": [
        {
          "url": "https://www.youtube.com/watch?v=9hz2kCabk5k",
          "label": "YouTube title (oEmbed)",
          "accessed_at": "2026-08-04",
          "supports": [
            "title_display"
          ]
        }
      ]
    },
    {
      "accession": "064",
      "youtube_id": "6tPUfz8My4Y",
      "title_source": "А-А-Зализняк-История-русского-ударения-2016-2017-гг-Аудиозапись-лекции-1-100916",
      "generated_title_display": "А. А. Зализняк История русского ударения 2016 2017 гг Аудиозапись лекции 1 100916",
      "decision": "overridden",
      "title_display": "А. А. Зализняк. История русского ударения. 2016-2017 гг. Аудиозапись лекции 1. 10.09.16",
      "evidence": [
        {
          "url": "https://www.youtube.com/watch?v=6tPUfz8My4Y",
          "label": "YouTube title (oEmbed)",
          "accessed_at": "2026-08-04",
          "supports": [
            "title_display"
          ]
        }
      ]
    },
    {
      "accession": "065",
      "youtube_id": "vs85X7hqFJs",
      "title_source": "А-А-Зализняк-История-русского-ударения-2016-2017-гг-Аудиозапись-лекции-11-19112016",
      "generated_title_display": "А. А. Зализняк История русского ударения 2016 2017 гг Аудиозапись лекции 11 19112016",
      "decision": "overridden",
      "title_display": "А. А. Зализняк. История русского ударения. 2016-2017 гг. Аудиозапись лекции 11. 19.11.2016",
      "evidence": [
        {
          "url": "https://www.youtube.com/watch?v=vs85X7hqFJs",
          "label": "YouTube title (oEmbed)",
          "accessed_at": "2026-08-04",
          "supports": [
            "title_display"
          ]
        }
      ]
    },
    {
      "accession": "066",
      "youtube_id": "l2TB7AY5Tus",
      "title_source": "А-А-Зализняк-История-русского-ударения-2016-2017-гг-Аудиозапись-лекции-7--22102016",
      "generated_title_display": "А. А. Зализняк История русского ударения 2016 2017 гг Аудиозапись лекции 7 22102016",
      "decision": "overridden",
      "title_display": "А. А. Зализняк. История русского ударения. 2016-2017 гг. Аудиозапись лекции 7. 22.10.2016",
      "evidence": [
        {
          "url": "https://www.youtube.com/watch?v=l2TB7AY5Tus",
          "label": "YouTube title (oEmbed)",
          "accessed_at": "2026-08-04",
          "supports": [
            "title_display"
          ]
        }
      ]
    },
    {
      "accession": "067",
      "youtube_id": "zBNyMMom0MQ",
      "title_source": "А-А-Зализняк-История-русского-ударения-2016-2017-гг-Лекция-10-12112016",
      "generated_title_display": "А. А. Зализняк История русского ударения 2016 2017 гг Лекция 10 12112016",
      "decision": "overridden",
      "title_display": "А. А. Зализняк. История русского ударения. 2016-2017 гг. Лекция 10. 12.11.2016",
      "evidence": [
        {
          "url": "https://www.youtube.com/watch?v=zBNyMMom0MQ",
          "label": "YouTube title (oEmbed)",
          "accessed_at": "2026-08-04",
          "supports": [
            "title_display"
          ]
        }
      ]
    },
    {
      "accession": "068",
      "youtube_id": "DZ_-gKx1kAE",
      "title_source": "А-А-Зализняк-История-русского-ударения-2016-2017-гг-Лекция-12-26112016",
      "generated_title_display": "А. А. Зализняк История русского ударения 2016 2017 гг Лекция 12 26112016",
      "decision": "overridden",
      "title_display": "А. А. Зализняк. История русского ударения. 2016-2017 гг. Лекция 12. 26.11.2016",
      "evidence": [
        {
          "url": "https://www.youtube.com/watch?v=DZ_-gKx1kAE",
          "label": "YouTube title (oEmbed)",
          "accessed_at": "2026-08-04",
          "supports": [
            "title_display"
          ]
        }
      ]
    },
    {
      "accession": "069",
      "youtube_id": "VKDg5GQdzkw",
      "title_source": "А-А-Зализняк-История-русского-ударения-2016-2017-гг-Лекция-13-03122016",
      "generated_title_display": "А. А. Зализняк История русского ударения 2016 2017 гг Лекция 13 03122016",
      "decision": "overridden",
      "title_display": "А. А. Зализняк. История русского ударения. 2016-2017 гг. Лекция 13. 03.12.2016",
      "evidence": [
        {
          "url": "https://www.youtube.com/watch?v=VKDg5GQdzkw",
          "label": "YouTube title (oEmbed)",
          "accessed_at": "2026-08-04",
          "supports": [
            "title_display"
          ]
        }
      ]
    },
    {
      "accession": "070",
      "youtube_id": "7ODUHMh-4-o",
      "title_source": "А-А-Зализняк-История-русского-ударения-2016-2017-гг-Лекция-14-10122016",
      "generated_title_display": "А. А. Зализняк История русского ударения 2016 2017 гг Лекция 14 10122016",
      "decision": "overridden",
      "title_display": "А. А. Зализняк. История русского ударения. 2016-2017 гг. Лекция 14. 10.12.2016",
      "evidence": [
        {
          "url": "https://www.youtube.com/watch?v=7ODUHMh-4-o",
          "label": "YouTube title (oEmbed)",
          "accessed_at": "2026-08-04",
          "supports": [
            "title_display"
          ]
        }
      ]
    },
    {
      "accession": "071",
      "youtube_id": "ATtkvTx6_4o",
      "title_source": "А-А-Зализняк-История-русского-ударения-2016-2017-гг-Лекция-15-17122016",
      "generated_title_display": "А. А. Зализняк История русского ударения 2016 2017 гг Лекция 15 17122016",
      "decision": "overridden",
      "title_display": "А. А. Зализняк. История русского ударения. 2016-2017 гг. Лекция 15. 17.12.2016",
      "evidence": [
        {
          "url": "https://www.youtube.com/watch?v=ATtkvTx6_4o",
          "label": "YouTube title (oEmbed)",
          "accessed_at": "2026-08-04",
          "supports": [
            "title_display"
          ]
        }
      ]
    },
    {
      "accession": "072",
      "youtube_id": "qWzBIm7x1Xc",
      "title_source": "А-А-Зализняк-История-русского-ударения-2016-2017-гг-Лекция-16-11022017",
      "generated_title_display": "А. А. Зализняк История русского ударения 2016 2017 гг Лекция 16 11022017",
      "decision": "overridden",
      "title_display": "А. А. Зализняк. История русского ударения. 2016-2017 гг. Лекция 16. 11.02.2017",
      "evidence": [
        {
          "url": "https://www.youtube.com/watch?v=qWzBIm7x1Xc",
          "label": "YouTube title (oEmbed)",